<?xml version="1.0"?>
<!DOCTYPE Report
[
<!ELEMENT Report (General ,(Doc|BPT)) >
<!ATTLIST Report ver CDATA #REQUIRED tmZone CDATA #REQUIRED>

<!ELEMENT General ( DocLocation ) >
<!ATTLIST General productName CDATA #REQUIRED productVer CDATA #REQUIRED os CDATA #REQUIRED host CDATA #REQUIRED qcserver CDATA #IMPLIED qcproject CDATA #IMPLIED SolManSolutionId CDATA #IMPLIED SolManProjectId CDATA #IMPLIED SolManTestPlanId CDATA #IMPLIED SolManTestPackageId CDATA #IMPLIED SolManUserInfoData CDATA #IMPLIED  >

<!ELEMENT BPT (DName,Res,DVer?,TSet?,TInst?,NodeArgs,AdditionalInfo*,Doc*) >
<!ATTLIST BPT rID ID #REQUIRED >

<!ELEMENT Doc (DName,ConfName?,Res,DVer?,TSet?,TInst?,RunType?,DT?,AdditionalInfo*,Step*,DIter*,Step*,Action*,Doc*,Summary?,TestMaintenanceSummary*,NodeArgs?) >
<!ATTLIST Doc rID ID #REQUIRED type (Test|BC|BPTWrapperTest|Flow|Group|Action) "Test" productName CDATA #REQUIRED BCIter CDATA #IMPLIED >

<!ELEMENT RunType ( #PCDATA )>
<!ATTLIST RunType fmStep (False|True) "False" batch (False|True) "False" upDesc (False|True) "False" upChk (False|True) "False" upAS (False|True) "False">

<!ELEMENT DName ( #PCDATA ) >

<!ELEMENT ConfName ( #PCDATA ) >

<!ELEMENT Res ( #PCDATA ) >

<!ELEMENT AdditionalInfo (AdditionalDataName,AdditionalDataValue ) >

<!ELEMENT AdditionalDataName ( #PCDATA ) >

<!ELEMENT AdditionalDataValue ( #PCDATA ) >

<!ELEMENT DVer ( #PCDATA ) >

<!ELEMENT TSet ( #PCDATA ) >

<!ELEMENT TInst ( #PCDATA ) >

<!ELEMENT DIter (Step*,Action+,Summary?,NodeArgs)>
<!ATTLIST DIter rID ID #REQUIRED iterID CDATA #REQUIRED>

<!ELEMENT DocLocation ( #PCDATA )>

<!ELEMENT Action (AName,AIter*,(Step|HtmlStep|Action)*, Summary,ActionMaintenanceSummary*, NodeArgs ) >
<!ATTLIST Action rID ID #REQUIRED>

<!ELEMENT AIter ((Step|HtmlStep|Action)*,DataMapping?, Summary?,NodeArgs) >
<!ATTLIST AIter rID ID #REQUIRED iterID CDATA #REQUIRED isCountable (False|True) "False" >

<!ELEMENT AName ( #PCDATA ) >

<!ELEMENT TestMaintenanceSummary (ActionMaintenanceSummary*) >
<!ATTLIST TestMaintenanceSummary ObjectsAdded CDATA #REQUIRED ObjectsUpdated CDATA #REQUIRED StepsUpdated CDATA #REQUIRED StepsComments CDATA #REQUIRED><!ELEMENT ActionMaintenanceSummary (ObjectChange* ) >
<!ATTLIST ActionMaintenanceSummary Action CDATA #REQUIRED Objects CDATA #REQUIRED Updated CDATA #REQUIRED LinesTotal CDATA #REQUIRED Added CDATA #REQUIRED LinesUpdated CDATA #REQUIRED>

<!ELEMENT ObjectChange  (Hierarchy, PropertyChangeList* ) >
<!ATTLIST ObjectChange Operation CDATA #IMPLIED OriginalRepository CDATA #IMPLIED>

<!ELEMENT PropertyChangeList (PropertyDef*) >

<!ELEMENT PropertyDef (OriginalValue, NewValue) >
<!ATTLIST PropertyDef PropName CDATA #REQUIRED OriginRegularExpression (True|False) "False" NewRegularExpression (True|False) "False" AddedProperty (True|False) "False" >

<!ELEMENT OriginalValue ( #PCDATA )>

<!ELEMENT NewValue ( #PCDATA )>

<!ELEMENT Hierarchy  (ObjectName, Hierarchy*) >
<!ATTLIST Hierarchy MicClass CDATA #REQUIRED>

<!ELEMENT ObjectName  ( #PCDATA ) >

<!ELEMENT Step (Obj,Details,Time,TimeTick* ,(Step|HtmlStep|Doc)*, DataMapping?, NodeArgs) >
<!ATTLIST Step rID ID #REQUIRED retval CDATA #IMPLIED>

<!ELEMENT HtmlStep (HTML,TimeTick*,(Step|HtmlStep|Doc)*,NodeArgs) >
<!ATTLIST HtmlStep rID ID #REQUIRED >

<!ELEMENT Obj ( #PCDATA ) >
<!ATTLIST Obj plainTxt (False|True) "True">

<!ELEMENT Details ( #PCDATA ) >
<!ATTLIST Details plainTxt (False|True) "True">

<!ELEMENT Time ( #PCDATA ) >

<!ELEMENT HTML ( #PCDATA ) >

<!ELEMENT Disp ( #PCDATA ) >

<!ELEMENT TimeTick ( #PCDATA ) >

<!ELEMENT DataMapping ( DataMappedItem* )>
<!ELEMENT DataMappedItem EMPTY >
<!ATTLIST DataMappedItem dsName CDATA #REQUIRED >
<!ATTLIST DataMappedItem rowId CDATA #REQUIRED >

<!ELEMENT NodeArgs (Disp,TopPane?,BtmPane?,ExtendedInfo? )>
<!ATTLIST NodeArgs eType CDATA #REQUIRED icon CDATA #REQUIRED nRep CDATA #REQUIRED UserNote CDATA #IMPLIED filter (False|True) "True">
<!ATTLIST NodeArgs status (Passed|Failed|Done|Warning|Information) "Done">
<!ATTLIST NodeArgs iconSel CDATA #IMPLIED nType CDATA #IMPLIED MovieMarker CDATA "">
<!ATTLIST NodeArgs Source CDATA #IMPLIED SourceLine CDATA #IMPLIED StepFlowItemKey CDATA #IMPLIED >

<!ELEMENT TopPane (Path)>

<!ELEMENT BtmPane ( (Path|WR)?,ASHilite?)>
<!ATTLIST BtmPane vType CDATA "HTML">

<!ELEMENT Path ( #PCDATA ) >

<!ELEMENT ASHilite ( #PCDATA ) >

<!ELEMENT WR ( #PCDATA ) >

<!ELEMENT ExtendedInfo ( StepData ) >

<!ATTLIST ExtendedInfo StepType CDATA #REQUIRED>
<!ELEMENT DT (NodeArgs) >
<!ATTLIST DT rID ID #REQUIRED>

<!ELEMENT Summary (Param*)>
<!ATTLIST Summary sTime CDATA #IMPLIED eTime CDATA #IMPLIED passed CDATA #IMPLIED failed CDATA #IMPLIED warnings CDATA #IMPLIED retval CDATA #IMPLIED stopped (False|True) "False" >

<!ELEMENT Param (ParamName,ParamVal)+ >
<!ATTLIST Param paramInOut (In|Out) "In">

<!ELEMENT ParamName ( #PCDATA ) >

<!ELEMENT ParamVal ( #PCDATA ) >

]
>
<Report ver="2.0" tmZone="India Standard Time">
<General productName="Micro Focus Unified Functional Testing" productVer="14.50" os="" host="INLEN8520024624"><DocLocation><![CDATA[C:\Payback\Payback_Project]]></DocLocation></General>
<Doc rID="T1"   productName= "Micro Focus Unified Functional Testing"  >
<DName><![CDATA[Payback_Project]]></DName>
<Res><![CDATA[Res75]]></Res>
<DT rID="T2">
<NodeArgs eType="Table" icon="2" nRep="4" filter="False" >
<Disp><![CDATA[Run-Time Data Table]]></Disp>
<BtmPane vType="Table" >
<Path><![CDATA[Default.xls]]></Path>
</BtmPane>
</NodeArgs>
</DT>
<Step rID="T3">
<Obj plainTxt="False" ><![CDATA[Add-in(s) not activated]]></Obj>
<Details plainTxt="False" ><![CDATA[The following add-in(s) were associated with your test, but are not currently loaded: 
Java, Mobile, Oracle.]]></Details>
<Time><![CDATA[06-09-2023 - 16:54:38]]></Time>
<TimeTick>1693999478</TimeTick>
<NodeArgs eType="Replay" icon="0" nRep="5" status="Warning" >
<Disp><![CDATA[Add-in(s) not activated]]></Disp>
</NodeArgs>
</Step>
<DIter rID="T4" iterID="1" >
<Action rID="T5">
<AName><![CDATA[Login]]></AName>
<Step rID="T6">
<Obj plainTxt="False" ><![CDATA[Zillion - aha, everywhere!_2]]></Obj>
<Details plainTxt="False" ><![CDATA[<table><tr><td><span style="text-align : left; font-size : 12px; ">Local Browser</span></td></tr></table>]]></Details>
<Time><![CDATA[06-09-2023 - 16:54:47]]></Time>
<TimeTick>1693999487</TimeTick>
<Step rID="T7">
<Obj plainTxt="False" ><![CDATA[Zillion - aha, everywhere!]]></Obj>
<Details plainTxt="False" ><![CDATA[Page]]></Details>
<Time><![CDATA[06-09-2023 - 16:54:47]]></Time>
<TimeTick>1693999487</TimeTick>
<Step rID="T8">
<Obj plainTxt="False" ><![CDATA[WebElement.Click]]></Obj>
<Details plainTxt="False" ><![CDATA[]]></Details>
<Time><![CDATA[06-09-2023 - 16:54:47]]></Time>
<TimeTick>1693999487</TimeTick>
<NodeArgs eType="Replay" icon="7" nRep="14" Source="Login" SourceLine="88" >
<Disp><![CDATA[WebElement.Click]]></Disp>
</NodeArgs>
</Step>
<Step rID="T9">
<Obj plainTxt="False" ><![CDATA[[ Ledger ].Click]]></Obj>
<Details plainTxt="False" ><![CDATA[]]></Details>
<Time><![CDATA[06-09-2023 - 16:54:47]]></Time>
<TimeTick>1693999487</TimeTick>
<NodeArgs eType="Replay" icon="7" nRep="17" Source="Login" SourceLine="89" >
<Disp><![CDATA[[ Ledger ].Click]]></Disp>
</NodeArgs>
</Step>
<NodeArgs eType="Context" icon="6" nRep="13" Source="Login" SourceLine="88" >
<Disp><![CDATA[Zillion - aha, everywhere!]]></Disp>
</NodeArgs>
</Step>
<Step rID="T10">
<Obj plainTxt="False" ><![CDATA[Profile | Zillion - aha,]]></Obj>
<Details plainTxt="False" ><![CDATA[Page]]></Details>
<Time><![CDATA[06-09-2023 - 16:54:47]]></Time>
<TimeTick>1693999487</TimeTick>
<Step rID="T11">
<Obj plainTxt="False" ><![CDATA[All.Click]]></Obj>
<Details plainTxt="False" ><![CDATA[]]></Details>
<Time><![CDATA[06-09-2023 - 16:54:47]]></Time>
<TimeTick>1693999487</TimeTick>
<NodeArgs eType="Replay" icon="7" nRep="22" Source="Login" SourceLine="90" >
<Disp><![CDATA[All.Click]]></Disp>
</NodeArgs>
</Step>
<Step rID="T12">
<Obj plainTxt="False" ><![CDATA[Earned.Click]]></Obj>
<Details plainTxt="False" ><![CDATA[]]></Details>
<Time><![CDATA[06-09-2023 - 16:54:47]]></Time>
<TimeTick>1693999487</TimeTick>
<NodeArgs eType="Replay" icon="7" nRep="25" Source="Login" SourceLine="91" >
<Disp><![CDATA[Earned.Click]]></Disp>
</NodeArgs>
</Step>
<Step rID="T13">
<Obj plainTxt="False" ><![CDATA[Expired.Click]]></Obj>
<Details plainTxt="False" ><![CDATA[]]></Details>
<Time><![CDATA[06-09-2023 - 16:54:47]]></Time>
<TimeTick>1693999487</TimeTick>
<NodeArgs eType="Replay" icon="7" nRep="28" Source="Login" SourceLine="92" >
<Disp><![CDATA[Expired.Click]]></Disp>
</NodeArgs>
</Step>
<Step rID="T14">
<Obj plainTxt="False" ><![CDATA[Redeemed.Click]]></Obj>
<Details plainTxt="False" ><![CDATA[]]></Details>
<Time><![CDATA[06-09-2023 - 16:54:47]]></Time>
<TimeTick>1693999487</TimeTick>
<NodeArgs eType="Replay" icon="7" nRep="31" Source="Login" SourceLine="93" >
<Disp><![CDATA[Redeemed.Click]]></Disp>
</NodeArgs>
</Step>
<Step rID="T15">
<Obj plainTxt="False" ><![CDATA[SELECT DATE.Click]]></Obj>
<Details plainTxt="False" ><![CDATA[]]></Details>
<Time><![CDATA[06-09-2023 - 16:54:48]]></Time>
<TimeTick>1693999488</TimeTick>
<NodeArgs eType="Replay" icon="7" nRep="34" Source="Login" SourceLine="94" >
<Disp><![CDATA[SELECT DATE.Click]]></Disp>
</NodeArgs>
</Step>
<Step rID="T16">
<Obj plainTxt="False" ><![CDATA[Today_2.Click]]></Obj>
<Details plainTxt="False" ><![CDATA[]]></Details>
<Time><![CDATA[06-09-2023 - 16:54:48]]></Time>
<TimeTick>1693999488</TimeTick>
<NodeArgs eType="Replay" icon="7" nRep="37" Source="Login" SourceLine="95" >
<Disp><![CDATA[Today_2.Click]]></Disp>
</NodeArgs>
</Step>
<Step rID="T17">
<Obj plainTxt="False" ><![CDATA[WebElement_2.Click]]></Obj>
<Details plainTxt="False" ><![CDATA[]]></Details>
<Time><![CDATA[06-09-2023 - 16:54:48]]></Time>
<TimeTick>1693999488</TimeTick>
<NodeArgs eType="Replay" icon="7" nRep="40" Source="Login" SourceLine="96" >
<Disp><![CDATA[WebElement_2.Click]]></Disp>
</NodeArgs>
</Step>
<Step rID="T18">
<Obj plainTxt="False" ><![CDATA[SELECT DATE.Click]]></Obj>
<Details plainTxt="False" ><![CDATA[]]></Details>
<Time><![CDATA[06-09-2023 - 16:54:48]]></Time>
<TimeTick>1693999488</TimeTick>
<NodeArgs eType="Replay" icon="7" nRep="43" Source="Login" SourceLine="97" >
<Disp><![CDATA[SELECT DATE.Click]]></Disp>
</NodeArgs>
</Step>
<Step rID="T19">
<Obj plainTxt="False" ><![CDATA[This week_2.Click]]></Obj>
<Details plainTxt="False" ><![CDATA[]]></Details>
<Time><![CDATA[06-09-2023 - 16:54:48]]></Time>
<TimeTick>1693999488</TimeTick>
<NodeArgs eType="Replay" icon="7" nRep="46" Source="Login" SourceLine="98" >
<Disp><![CDATA[This week_2.Click]]></Disp>
</NodeArgs>
</Step>
<Step rID="T20">
<Obj plainTxt="False" ><![CDATA[WebElement_2.Click]]></Obj>
<Details plainTxt="False" ><![CDATA[]]></Details>
<Time><![CDATA[06-09-2023 - 16:54:48]]></Time>
<TimeTick>1693999488</TimeTick>
<NodeArgs eType="Replay" icon="7" nRep="49" Source="Login" SourceLine="99" >
<Disp><![CDATA[WebElement_2.Click]]></Disp>
</NodeArgs>
</Step>
<Step rID="T21">
<Obj plainTxt="False" ><![CDATA[SELECT DATE.Click]]></Obj>
<Details plainTxt="False" ><![CDATA[]]></Details>
<Time><![CDATA[06-09-2023 - 16:54:48]]></Time>
<TimeTick>1693999488</TimeTick>
<NodeArgs eType="Replay" icon="7" nRep="52" Source="Login" SourceLine="100" >
<Disp><![CDATA[SELECT DATE.Click]]></Disp>
</NodeArgs>
</Step>
<Step rID="T22">
<Obj plainTxt="False" ><![CDATA[Last 30 days_2.Click]]></Obj>
<Details plainTxt="False" ><![CDATA[]]></Details>
<Time><![CDATA[06-09-2023 - 16:54:48]]></Time>
<TimeTick>1693999488</TimeTick>
<NodeArgs eType="Replay" icon="7" nRep="55" Source="Login" SourceLine="101" >
<Disp><![CDATA[Last 30 days_2.Click]]></Disp>
</NodeArgs>
</Step>
<Step rID="T23">
<Obj plainTxt="False" ><![CDATA[WebElement_2.Click]]></Obj>
<Details plainTxt="False" ><![CDATA[]]></Details>
<Time><![CDATA[06-09-2023 - 16:54:48]]></Time>
<TimeTick>1693999488</TimeTick>
<NodeArgs eType="Replay" icon="7" nRep="58" Source="Login" SourceLine="102" >
<Disp><![CDATA[WebElement_2.Click]]></Disp>
</NodeArgs>
</Step>
<Step rID="T24">
<Obj plainTxt="False" ><![CDATA[SELECT DATE.Click]]></Obj>
<Details plainTxt="False" ><![CDATA[]]></Details>
<Time><![CDATA[06-09-2023 - 16:54:48]]></Time>
<TimeTick>1693999488</TimeTick>
<NodeArgs eType="Replay" icon="7" nRep="61" Source="Login" SourceLine="103" >
<Disp><![CDATA[SELECT DATE.Click]]></Disp>
</NodeArgs>
</Step>
<Step rID="T25">
<Obj plainTxt="False" ><![CDATA[Last 90 days_3.Click]]></Obj>
<Details plainTxt="False" ><![CDATA[]]></Details>
<Time><![CDATA[06-09-2023 - 16:54:48]]></Time>
<TimeTick>1693999488</TimeTick>
<NodeArgs eType="Replay" icon="7" nRep="64" Source="Login" SourceLine="104" >
<Disp><![CDATA[Last 90 days_3.Click]]></Disp>
</NodeArgs>
</Step>
<Step rID="T26">
<Obj plainTxt="False" ><![CDATA[WebElement_2.Click]]></Obj>
<Details plainTxt="False" ><![CDATA[]]></Details>
<Time><![CDATA[06-09-2023 - 16:54:48]]></Time>
<TimeTick>1693999488</TimeTick>
<NodeArgs eType="Replay" icon="7" nRep="67" Source="Login" SourceLine="105" >
<Disp><![CDATA[WebElement_2.Click]]></Disp>
</NodeArgs>
</Step>
<Step rID="T27">
<Obj plainTxt="False" ><![CDATA[SELECT DATE.Click]]></Obj>
<Details plainTxt="False" ><![CDATA[]]></Details>
<Time><![CDATA[06-09-2023 - 16:54:48]]></Time>
<TimeTick>1693999488</TimeTick>
<NodeArgs eType="Replay" icon="7" nRep="70" Source="Login" SourceLine="106" >
<Disp><![CDATA[SELECT DATE.Click]]></Disp>
</NodeArgs>
</Step>
<Step rID="T28">
<Obj plainTxt="False" ><![CDATA[Custom Date_3.Click]]></Obj>
<Details plainTxt="False" ><![CDATA[]]></Details>
<Time><![CDATA[06-09-2023 - 16:54:48]]></Time>
<TimeTick>1693999488</TimeTick>
<NodeArgs eType="Replay" icon="7" nRep="73" Source="Login" SourceLine="107" >
<Disp><![CDATA[Custom Date_3.Click]]></Disp>
</NodeArgs>
</Step>
<Step rID="T29">
<Obj plainTxt="False" ><![CDATA[1.Click]]></Obj>
<Details plainTxt="False" ><![CDATA[]]></Details>
<Time><![CDATA[06-09-2023 - 16:54:48]]></Time>
<TimeTick>1693999488</TimeTick>
<NodeArgs eType="Replay" icon="8" nRep="76" Source="Login" SourceLine="108" >
<Disp><![CDATA[1.Click]]></Disp>
</NodeArgs>
</Step>
<Step rID="T30">
<Obj plainTxt="False" ><![CDATA[3.Click]]></Obj>
<Details plainTxt="False" ><![CDATA[]]></Details>
<Time><![CDATA[06-09-2023 - 16:54:48]]></Time>
<TimeTick>1693999488</TimeTick>
<NodeArgs eType="Replay" icon="8" nRep="79" Source="Login" SourceLine="109" >
<Disp><![CDATA[3.Click]]></Disp>
</NodeArgs>
</Step>
<Step rID="T31">
<Obj plainTxt="False" ><![CDATA[APPLY.Click]]></Obj>
<Details plainTxt="False" ><![CDATA[]]></Details>
<Time><![CDATA[06-09-2023 - 16:54:48]]></Time>
<TimeTick>1693999488</TimeTick>
<NodeArgs eType="Replay" icon="8" nRep="82" Source="Login" SourceLine="110" >
<Disp><![CDATA[APPLY.Click]]></Disp>
</NodeArgs>
</Step>
<Step rID="T32">
<Obj plainTxt="False" ><![CDATA[WebElement_2.Click]]></Obj>
<Details plainTxt="False" ><![CDATA[]]></Details>
<Time><![CDATA[06-09-2023 - 16:54:49]]></Time>
<TimeTick>1693999489</TimeTick>
<NodeArgs eType="Replay" icon="7" nRep="85" Source="Login" SourceLine="111" >
<Disp><![CDATA[WebElement_2.Click]]></Disp>
</NodeArgs>
</Step>
<NodeArgs eType="Context" icon="6" nRep="21" Source="Login" SourceLine="90" >
<Disp><![CDATA[Profile | Zillion - aha,]]></Disp>
</NodeArgs>
</Step>
<NodeArgs eType="Context" icon="5" nRep="12" Source="Login" SourceLine="88" >
<Disp><![CDATA[Zillion - aha, everywhere!_2]]></Disp>
</NodeArgs>
</Step>
<Summary sTime="06-09-2023 - 16:54:46" eTime="06-09-2023 - 16:54:49" passed="0" failed="0" warnings="0" ></Summary>
<NodeArgs eType="StartAction" icon="4" nRep="9" >
<Disp><![CDATA[Login Summary]]></Disp>
</NodeArgs>
</Action>
<NodeArgs eType="StartIteration" icon="3" nRep="7" >
<Disp><![CDATA[Payback_Project Iteration 1 (Row 1)]]></Disp>
</NodeArgs>
</DIter>
<Summary sTime="06-09-2023 - 16:54:38" eTime="06-09-2023 - 16:54:49" passed="0" failed="0" warnings="1" ></Summary>
<NodeArgs eType="StartTest" icon="1" nRep="3" status="Warning" >
<Disp><![CDATA[Test Payback_Project Summary]]></Disp>
</NodeArgs>
</Doc>
</Report>